"customer_id","date","rating","reviewText","imageCount","helpfulCount","nonHelpfulCount"
"20011344","19 апреля, 23:27","5","Отличная качественная вещь",0,"0","0"
"14576641","28 сентября 2019, 13:00","5","Очень мягкий приятный ношу 44_46 взяла s можно смело брать xc",1,"2","2"
"15419869","21 марта, 19:19","5","Цвет непередаваемый, не стала даже фотографировать, камера на телефоне этот оттенок не передаст. Специально решила взять большой рр. С кожаными леггинсами чтобы. По длине как раз то получилось. На рост 168 закрыл бедра. Правда на мой 46 рр оверсайз крутой получился).и конечно горловина глубокая. Попробую с боков отрезать оверлоком. А по качеству вот что думаю. Даже если мех немного потеряется в процессе носки, то плотность такова, что особо не потеряет в тепле и виде. Все равно будет хорошо смотреться. Заказала ещё один, редкий цвет, очень понравился давно искала что-то подобное.",0,"1","0"
"18620345","21 марта, 9:22","5","Свитер этот купила несколько месяцев назад. Хочу высказать благодарность производителю. Шикарный свитер, после стирки выглядит, как новый. Даже еще лучше! Ворс не слеживается, как это бывает обычно в свитерах подобного качества.",0,"2","0"
"18534398","20 марта, 17:22","5","На 50 взяла l. В размер не берите - слишком свободна. Стирала руками, сушила горизонтально, отпаривала долго - кофта сохранилась. Синий цвет яркий, как на фото. Мне кофта нравится, приятная к телу.",0,"1","0"
"3048377","17 марта, 13:43","5","купила к телу приятная на 48 размер подошла s рукав по локоть но понравилась",0,"0","0"
"5237060","8 декабря 2019, 18:00","1","Первые впечатления от кофты очень положительные. Но после третьей стирки кофта испортилась, внешний вид отвратительный. Почему-то на спине в области лопаток, пушистость исчезла. Травки нет совсем, а в низу и впереди травка осталась. Удивительно, первый раз такое вижу, как будто елозила лопатками по нождачке. Стирала руками в “Ласке"" для стирки шерсти и шелка.",2,"9","0"
"11215327","2 декабря 2019, 13:31","1","После стирки больше носить невозможно. Ткань как-будто носили лет 20. Не советую, качество ужасное.",0,"2","0"
"18376927","13 ноября 2019, 13:30","5","Цвет черника,отпарила,получилась пушистая жилеточка, с учетом того, что меховые кофточки в тренде,да со скидкой вполне довольна, и тепло.",0,"0","0"
"6562601","8 ноября 2019, 17:34","5","На свой 50 подошёл размер L,, можно и меньше брать, но это на любителя, кофточка супер, очень понравилась, только как все пушистое😁требует отпарить .",0,"0","0"
"19413290","7 ноября 2019, 11:13","5","Замечательный свитер. Сел как надо! Цвет совпадает! Спасибо магазину, ооооочень довольна!!!!!!!",0,"1","0"
"2657836","27 октября 2019, 19:16","2","Цвет просто очень красивый.хs сел в самый раз.не оверсайс.но пришол брак.горловина кривая .рукав один длиннее другого. Очень понравился .взяла бы с удовольствием если бы не брак.размеры s и м уже обьёмней и полнят.",0,"0","0"
"14714790","27 октября 2019, 15:29","5","Суперский, цвет красивый, очень мягкий и приятный",0,"0","1"
"15117973","23 октября 2019, 18:36","5","Оч классный! В размер. Цвет черника. Жаль только что рукав не длинный.",0,"0","2"
"2796149","22 октября 2019, 11:24","5","Цвет синий очень глубокий и насыщенный. Мягкий, приятный свитер.",0,"0","1"
"6601420","17 октября 2019, 12:05","5","Кофта симпатичная, пушистая, к телу очень приятная, ношу 48/50, а L оказалось очень большой перезаказала на S , очень хорошо села. Рекомендую к покупке, но как минимум на один размер меньше того какой вы носите. В идеале бы рукава подлиннее и поменьше вырез на груди.",0,"0","2"
"4774278","25 сентября 2019, 16:30","5","Отличный свитер. Ношу 42-44, опираясь на отзывы взяла хs, сидит хорошо, свободно, рукава короткие, см на 7 ниже локтя(меня не смутило). Свитер мягкий, пушистый, теплый. Цвет красивый. Спасибо магазину)",3,"5","2"
"4774278","14 октября 2019, 19:12","5","Неправильно указала, ниже локтя на 15 см",0,"0","0"
"12585332","13 октября 2019, 19:28","5","Классная кофточка, очень красивый цвет! Мой размер 44-46, подошёл XS",1,"5","4"
"17747211","11 октября 2019, 13:19","5","Согласна с большинством отзывов. Действительно очень красивый цвет. Мягкий-мягкий. Такой уютный. Довольно большой вырез. Размер S на мой реальный 42-44 сидит точно также, как на моделе. На всякий случай заказала все-таки ещё и xs для сравнения. Но не исключаю, что оставлю тот, что больше. Оверсайз актуален сейчас.",0,"1","4"
"5033910","6 октября 2019, 1:38","5","Свитер обалденный! Мягкий, приятный к телу. После первой стирки не изменился (не знаю как будет после последующих). Цвет синий очень красивый! Сидит свободно, но я так и хотела.",0,"1","1"
"20184892","3 октября 2019, 8:32","5","Приятный, стильный, красивый! Для офиса вообще находка!",1,"5","1"
"11833862","1 октября 2019, 21:40","5","Мне понравилась. Очень мягкая. Приятная))",0,"0","1"
"17398682","29 сентября 2019, 14:58","5","Я влюбилась в этот свитер, приятен к телу, очень теплый",0,"0","1"
"10820172","27 сентября 2019, 18:25","5","Красивый цвет, очень мягкий и нежный! Сначала когда посмотрела на него без примерки не понравился, а когда одела,то уже не хотелось и снимать. На свой размер 42-44 взяла хс.",1,"1","4"
"16097656","26 сентября 2019, 17:43","5","Отличный полувер, цвет красивый, размер соответствует ОГ 104(2Xl), для тех кто любит в облипочку смело можно брать на размер меньше. К телу приятный не колется. Очень довольна покупкой.",0,"0","0"
"21429323","26 сентября 2019, 8:23","5","Свитер красивый и тёплый, но на мой 44-46 прекрасно сел 42, если бы не предыдущие отзывы, утонула бы в своём размере. Большемерит на размер, полтора. Кому не нужен оверсайз, берите меньше. А так хороший мягкий свитерок.",0,"0","1"
"9605477","25 сентября 2019, 16:47","5","Почитав отзывы, что большемерит, заказала свой размер L-ку, пусть будет овер сайз. Так много восторженных отзывов, но меня свитер не впечатлил. Никакой пушистости я не увидела, ворс как ""прилизанный"" или свалявшийся, сидит как бесформенный мешок, к тому же свитер тяжёлый, а пряжа скользкая на ощупь и он соскальзывает с плеч. Может с размером не угадала, но у меня уже есть свитер овер сайз аж 52 размера, он почему-то комфортно сидит, значит это пряжа такая скользкая и тяжёлая. Поэтому отказ.",1,"4","3"
"13260649","25 сентября 2019, 14:30","5","После покупки, не могу из него вылезти, действительно, плюшевый мишка))) Мягкий, приятный к телу, тёплый и уютный!! На параметры 88-68-88 размер XS свободно и комфортно.",0,"1","1"
"10334996","18 сентября 2019, 20:33","5","Очень порадовало качество, очень приятный, мягкий, брала в подарок, на счёт размера не знаю",0,"0","1"
"17159337","17 сентября 2019, 7:31","5","свитер овер овер сайз. берите на размер. а то и 2 меньше. приятный к телу, прям котик, а не свитер. 2 минуса сразу- в зоне подмышек скатывается эта шерсть, и как стирать. чтобы он не скатался в барашка я не знаю. не пробовала даже еще.",0,"0","2"
"3981613","11 сентября 2019, 10:10","5","Огромный свитер на даму 50 размера, на мой рос. 48-очень велик. Отказ.",0,"0","5"
"15124802","10 сентября 2019, 18:51","5","Симпотичный, ярко синий свитер. Мягкий, приятный к телу. Заказала два размера, но не стала брать на размер больше, так как думаю, что во время носки будет растягиваться. Надеюсь после стирки с ним ничего ужасного не случится.",0,"0","0"
"6184877","23 сентября 2018, 12:33","5","Поправилась очень. Мягкий, цвет белый,длинна хорошая.еще не носила,не знаю будет лезть или нет. Думаю будет выглядеть нарядной",0,"7","3"
"13165231","8 августа 2019, 8:46","5","Свитер очень мягкий и приятный к телу. Цвет как на картинке. Мех чуть примят, но в целом вещь порадовала",1,"6","0"
"10084717","7 августа 2019, 16:58","5","Почему то не вдохновила.Может на худеньких девочках и хорошо смотрится,но я стала выглядеть,как медвежонок.Может правда надо попробовать меньше размером.По качеству нареканий нет,мягенький,плюшевый,приятный к телу.",1,"7","2"
"9533429","29 июля 2019, 11:03","4","Мерили на параметры 86-62-92; вес50 рост168; плечи 37,- не понравилось. Прежде всего рукава 2/3. Смотрится сваляным, но возможно его нужно простирнуть с ленором и высушить, чтобы ворс распушился и не смотрелся таким общипанным...",0,"3","1"
"5880153","19 июля 2019, 11:37","5","Клёвый . Мягкий как плед плюшевый. Нитки (пушистость каторые придают) не вылазят . Подмят правда но отпариватель все исправит .",2,"2","2"
"10796741","16 июля 2019, 21:26","5","Мне понравился. Интересный крой, мохра не лезет, мягкий и приятный к телу. Идет в размер. Рекомендую к покупке.",0,"0","1"
"19897350","14 июля 2019, 12:01","5","Размеру соответствует, но синтетику брать за 1000 р не советую",0,"1","3"
"1013069","8 июля 2019, 12:29","3","Кофта сидит не плохо. Но пришла с затяжками, поэтому отказ. И цвет не такой насыщенный. По ощущениям мягкая, приятная.",0,"0","1"
"9256230","24 июня 2019, 14:39","5","Пушистый, приятный, ну невозможно не взять, как плюшевого мишку из магазина. Берите на размер больше, чтобы свободно сидел. В облипку не смотрится. Кипельно-белый.",0,"1","1"
"10957413","21 мая 2019, 9:06","5","Суперский но после стирки не такой пушистый.теплый и приятный телу.",0,"4","2"
"13953260","29 апреля 2019, 13:38","5","Очень крутой свитер, мягкий, удобный! Спасибо магазину за скидку!",0,"0","3"
"13719520","19 апреля 2019, 20:16","5","Просто чудо!!!очень советую!",1,"5","6"
"1259443","3 апреля 2019, 11:04","5","Очень клевый! Я ношу 44, взяла XL, получился оверсайз, в белом цвете смотрится стильно!",0,"1","3"
"15575443","2 апреля 2019, 3:21","4","Свитер конкретный оверсайз. Подойдет миниатюрным девушкам. Если брать по фигуре-размера на два меньше от своего, но тогда рукав 3/4 будет,наверное, даже выше локтя. Жаль прогадала с фасончиком... Цвет шикарный. Очень мягкий..Отказ",0,"0","7"
"18351837","31 марта 2019, 15:35","2","Размер в размер,но выглядит по мне очень дёшево....не приобрела",0,"2","5"
"5371755","30 марта 2019, 15:03","5","Ужасный запах, цвет красивый,пряжа не шелковистая не понравилась!",0,"0","4"
"10686954","28 марта 2019, 21:16","4","Шикарный синий цвет. К телу джемпер приятный. Но на 48 размер 101-76-102 мне показался большим, даже как оверсайз. Рукав 3/4. Попробую заказать меньший размер, т.к. в целом, свитерок понравился. С джинсами должно быть вообще улет.",2,"6","1"
"13002328","28 марта 2019, 21:07","5","Снимать не хочется. Супер качество....",0,"0","2"
"11525156","27 марта 2019, 15:27","5","Хороший свитер. Цвет изумительный. На 48 размер смотрится как на фото. Спасибо.",0,"0","1"
"17899670","23 марта 2019, 20:32","5","Шикарный свитер за свои деньги. Цвет просто бомба. Приятно ощущается на теле.",1,"20","1"
"8845508","22 марта 2019, 9:50","5","мерить не стала, т.к. скрипучая синтетика",0,"2","4"
"11079476","20 марта 2019, 20:12","5","Классный джемпер,мягенький и приятный к телу. При стирке правда линяет,что впечатлило что при стирке ворс не вываливаля ,лучше стирать в ручную.",0,"0","2"
"6078158","20 марта 2019, 15:23","5","Свитер очень красивый. Как будет выглядеть после стирки - вопрос. А пока очень довольна.",0,"0","2"
"9964238","20 марта 2019, 8:35","5","Размер М на 46 сел прекрасно! Несмотря на синтетику , в нем тепло и уютно! Спасибо !",0,"0","1"
"2056112","19 марта 2019, 18:40","5","Яркий, мягкий, размер соответствует, взяла на размер больше, мне так больше нравится, можно оголить плечо😊, спасибо wb и курьеру👍",0,"0","1"
"3435538","19 марта 2019, 15:26","5","Свитер отличный! Мягкий, стильный, смотрится класс!",0,"0","1"
"11488058","16 марта 2019, 14:57","5","Свитер отличный! Мягкий, приятный к телу. Цвет насыщенный. Размеру соответствует. Спасибо!",0,"0","2"
"13366643","16 марта 2019, 14:13","5","Оставила,на 42-44,xs.Никак не ожидала,что такой тяжелый.",0,"1","0"
"16239128","12 марта 2019, 14:32","5","Замечательная кофточка, всё по размеру,надеюсь и после стирки не разочаруюсь.",0,"0","2"
"12135322","11 марта 2019, 19:49","1","Столько положительно-восхитительных отзывов. как о разных товарах, потому как о том, что мне пришло не могу сказать ничего хорошего. Внешне не пушистое и не мягкое, а облезлое и колется к телу. А треск стоит как только вытащил вещь из пакета. Решила померить, после снятия все волосы в разные стороны растопырило. Даже за 300 р не взяла бы.",0,"4","3"
"6001138","8 марта 2019, 15:37","4","если правильно прикреплена этикетка, а она прикреплена булавкой. то на мой 52 раз велика на 2 размера.",0,"0","2"
"5511199","6 марта 2019, 19:37","4","Сел хорошо на мой взгляд. Не взяла , потому что очень электризовался.",1,"2","5"
"11773036","2 марта 2019, 18:16","4","Магнитит очень сильно,на рост 175 коротковата.",0,"0","2"
"7481577","28 февраля 2019, 21:55","5","Свитер просто супер! Цвет шикарный. Сидит очень хорошо, получаю море комплиментов 😊 Единственное, он после стирки и глажки ооочень электризовался, но антистатик решил эту проблему 👍 к телу приятный, мягкий и теплый. И да, он красится.",0,"1","0"
"2439543","28 февраля 2019, 14:27","5","На свой 42-44 XS даже я бы сказала большеват, но я взяла, он такой классный!",0,"1","1"
"16089484","23 февраля 2019, 15:58","5","Покупала дочке на подарок. Дочка осталась довольна, практически из неё не вылазит.",0,"1","2"
"12463092","19 февраля 2019, 23:29","4","Странная вещь. Рост 170, короткая. От талии широкая . Не знаю даже, как описать. Смотрится как то непонятно. Отказ.",0,"0","3"
"11162374","19 февраля 2019, 13:39","2","Даже не знаю что сказать. Очень ждала свитерок смотрела отзывы и фото в них, и грезила. Впечатление такое что мне прислали вовсе другой свитер. Фирма вроде та же... Только вынула его из пакета он тут же начал трещать у меня в руках, одела и уже не приятно липнет к телу и трещит. Колючий, ни какой не мягонький как писали ранее. К телу не приятен. Цвет не такой как на фото, а более яркий что ли, короче не тот, цвет больше подойдет ребенку нежели девушке-женщине. Ворса примятая и с виду похожа на искусственный дешёвый мех из которого новогодние костюмы детям шьют. Не пушистый. Короче кошмар. В общем отказ.",0,"3","1"
"14348605","17 февраля 2019, 22:05","5","Отличный свитер, тёплый, очень стильный и при этом универсальный. На ОГ 85 и рост 170 сел как на модели. Сомневалась брать или нет, потому что в пакете выглядел как ободранная кошка, но решила выкупить и не пожалела: кондиционер и расчёска решили все проблемы) качество бомба. В магазинах подобные при примерке оставляли ворс... с этим все в норме",0,"1","0"
"4802638","11 февраля 2019, 21:14","5","Ношу этот джемпер всю зиму, очень довольна! Мягкий, тёплый, приятный. Уже стирала, причесала и опять все хорошо. У меня темно- синий, синий мне не понравился по цвету и равномерности окраса. Посмотрела бы ещё белый, но нет моего размера . Очень рекомендую!",0,"6","0"
"9461206","2 ноября 2018, 14:37","5","Джемпер тёплый, лёгкий, пушистый, очень приятный на ощупь, пух не лезет и не оставляет ворс на одежде, на 52 взяла L все отлично, советую к приобретению.",0,"5","2"
"9461206","11 февраля 2019, 12:22","5","Хорошая, уютная вещь, не лезет, в стирке отлично, перенесла 4 стирки в машине, ничего не изменилось, катышков нет, ношу всю зиму с удовольствием.",0,"0","0"
"9501928","11 февраля 2019, 10:49","3","А мне свитер не понравился. Рукава как-будто 3/4. И ладно бы только рукава расстроили, сама фактура как пушок...станет одним большим катышком через пару выходов. На фото смотрится намного интереснее.",0,"0","3"
"12088050","10 февраля 2019, 19:31","5","Супер, спасибо Зарина. На обхват груди 108 см, подошло XL.",0,"0","2"
"9470352","10 февраля 2019, 16:35","5","Прекрасный свитер! Очень довольна покупкой! Нужно брать свой размер! Если размер меньше - вид уже не тот у свитера! На рост 175 сел отлично!",0,"1","1"
"1826625","8 февраля 2019, 18:54","3","Рукав даже не 3/4 а только до локтя. Смотрится странно. Отказ.",0,"0","1"
"15465300","8 февраля 2019, 18:41","5","На 46 размер 44 сел просто идеально, скрыл недостатки. Немного залежался, надеюсь расправится. Выглядит очень стильно, насколько будет практичен время покажет",0,"1","2"
"11543483","8 февраля 2019, 17:01","3","Качество не очень, аж скрипит в руках как стекловата. Отказ.",0,"2","2"
