"customer_id","date","rating","reviewText","imageCount","helpfulCount","nonHelpfulCount"
"14152899","7 февраля 2019, 19:21","5","Мой рост 170, размер 42 (86-62-88). Заказала XS подошла. Кофта мягкая, приятная на ощупь. Только рукава 3/4, а об этом нигде не сказано, на фото рукав длинный. Крой странный.",3,"1","2"
"17011416","16 января 2019, 13:59","5","Крутая кофточка. Большемерка.",0,"0","2"
"15033715","5 января 2019, 15:26","5","Классная кофта, мягкая, яркая, как на фото. Брала xs на 42 размер, подошла, можно даже чуть меньше было взять, но это был самый маленький размер. В целом смотрится хорошо.",0,"0","1"
"6122349","30 декабря 2018, 14:43","5","Полностью соответствует фото",1,"33","2"
"5215428","20 декабря 2018, 21:57","5","Супер! Смотрится отлично, на 44 размер s подошел, рекоменлую, цвет яркий, насыщенный, спасибо)))",0,"1","2"
"8968789","20 декабря 2018, 11:53","2","Мягкий. На этом плюсы закончились. Мех сыпался с пакета, сидит на фигуре очень нелепо, как мешок какой то. Может дамам с пышными формами самое то, но для худеньких - нет. Выглядит глупо",0,"1","4"
"6340276","15 декабря 2018, 10:45","5","не впечатлил, тяжелый, рукава 3/4, не мое видимо.",0,"2","2"
"16028638","13 декабря 2018, 14:35","5","Мягкая, приятная к телу, мне просто не подошол фасон...",0,"1","2"
"15986451","10 декабря 2018, 21:22","4","Очень синтетика. Стреляет. Отказ.",0,"2","3"
"16645502","6 декабря 2018, 8:34","5","Кофта супер! Цвет очень яркии. Вязка плотная. Смотрится дорого",1,"5","2"
"8125681","5 декабря 2018, 11:55","5","Свитерок супер.Взяла свой размер,оказался уж очень оверсаис,хотелось не такой просторный,но не беда,взяла маме,она в восторге.Единственное,что смутило,на ценнике написано 1999,а цена на сайте 2200.",1,"6","1"
"6155165","29 ноября 2018, 22:54","1","В темно-синем, извините, как кошка драная. На фото ровный и пушистый, а в реале ворс лежит неравномерно, проплешинами. Где лежит, где торчит. От этого пятнами цвет. Выглядит помято. Ещё и толстая бесформенная, а рукава чуть ниже локтя. Отказ",0,"3","6"
"2218912","29 ноября 2018, 9:16","5","Замечательная кофточка, мягкая, пушистая. На 48-50 р-р L слишком свободная. Можно было поменьше, хотя если грудь большая тогда наверное нормально. Все равно взяла, в боках можно ушить.",0,"0","4"
"10021283","23 ноября 2018, 8:10","3","Ох, так ждала, начитавшись восторженных отзывов, а получила шкурку паука на хэллоуин))) серьёзно, может, в белом цвете свитер и выглядит мило, но в темно-синем это жесть: материал - очень плотный блестящий мех, по-другому и не скажешь, постояла возле зеркала, как в целлофановом пакете. Рукава-подстрелыши, что видно и на фото, дополняют антураж). В общем, в темно-синем не рассчитывайте выглядеть милыми и пушистыми.",0,"4","5"
"11637898","19 ноября 2018, 16:36","5","Просто суперррр нереальный свитер!!!Очень мягкий,приятный к телу,цвет красивый. На 44 р. взяла 42.Сидит свободно как я хотела.",0,"3","1"
"8799455","18 ноября 2018, 14:10","5","на объем груди 100 размер L оказался невероятно большой,надо заказывать на размер меньше",0,"1","0"
"9419167","18 ноября 2018, 13:55","5","Какой-то несурвзный джемпер. На 46 -m- рукова короче чем на модели. Выше локтя. Не понравился.",0,"1","3"
"9868883","18 ноября 2018, 8:00","5","Очень долго ждала в белом цвете размер xs и не зря!!! Очень красивый и нежный",0,"4","1"
"16200544","17 ноября 2018, 14:12","5","Свитер очень мягкий и уютный. Обратите внимание, что он сильно большемерит. На параметры 100х75х95 - размер S чуть свободно, смотрится как на модели на фото. В целом заказом очень довольна 👍🏻",0,"4","2"
"7981663","11 ноября 2018, 16:11","4","Суперский, мягкий,но большемериь на мой 50й L оказался большой..буду добавить М-ку",0,"0","2"
"8641264","15 ноября 2018, 2:04","5","ОНА так сильно линяет!!!решила сполоснуть после покупки..вода синючая!!!!боюсь одевать",0,"1","2"
"4453305","10 ноября 2018, 21:33","5","Очень крутой свитер,как на картинке увидела,сразу поняла-мой. Мягкий,тепленький,пушистый,снимать не хочется,в размер",0,"2","1"
"11102049","10 ноября 2018, 17:54","5","Свитер понравился - приятный на ощупь. И цвет, и размер подошёл. Единственное, что смутило- ворсинки все в разные стороны. Из- за этого смотрится как-то неопрятно. Может со временем изменится ....",0,"0","2"
"11894280","10 ноября 2018, 15:25","5","Прекрасный джемпер,мягкий и тёплый.",0,"0","1"
"1124273","9 ноября 2018, 9:33","4","На рост 178 смотрится очень куце.",0,"0","0"
"14969595","6 ноября 2018, 16:56","5","Чудесный! Отличный цвет - глубокий синий, не скатывается, теплый.",0,"0","0"
"4839668","6 ноября 2018, 11:59","5","Очень расстроена...заказала xl на 48-50 и утонула...кажется что в него и мама моя влезет с ее 56...очень понравился хотела перезаказать на lку но ее как назло нет.Поставила в лист ожидания.Очень жду.Но в этом размере мне показалось что рукова чуть коротковаты.Тогда в lке еще короче будут?но он такой мягенький беленький и пушистенький что не хотелось снимать но весел на мне мешком..Очень прошу магазин не снимать процент выкупа.А отзывы это настолько всё индивидуально..Думаю может еще и М заказать для сравнения...при стирке же он на мой взгляд растянется...",0,"0","4"
"10669514","1 ноября 2018, 19:14","5","Очень милая, нежная кофточка, жаль, что оказалась велика. Буду ждать, когда появится размер поменьше.",0,"2","2"
"12271925","1 ноября 2018, 11:59","5","Классный свитер. Теплый, мягкий, пушистый. Такие сейчас на пике популярности. Синий цвет очень насыщенный, яркий, даже не ожидала. Хорошая длина можно одеть с поясом, можно заправить. В темном цвете не понравился, не пушистый, весь помятый, облезлый вид. Рекомендую синий. Размеру соответствует.",0,"5","0"
"13171722","31 октября 2018, 17:07","5","Заказала на Российский 44 S-ку. Слегка большемерит, но я люблю чтобы не обтягивало. Мягкий, тёплый, для тела очень приятный. Сегодня надела на работу, коллеги обратили внимание, в хорошем смысле))). Не знаю, как поведёт себя после стирки, надеюсь, не сваляется. На фото выглядит хуже, чем на самом деле( да и я получилась крупнее))).",2,"21","3"
"2422321","30 октября 2018, 23:34","5","Просто прелесть! Не линяет! Теплый и очень уютный! XS на 40/42, на рост 176 длина отличная, не короткий, рукава получаются 3/4.",0,"0","0"
"5339267","27 октября 2018, 20:39","2","Совсем не мой вариант",0,"0","8"
"10208624","27 октября 2018, 12:21","5","Отличная кофта👍🏻Мягкая,приятная кофта!Незнаю Конечно какая после стирки)Размер М на 46 все соответствует!!!",1,"3","3"
"846352","26 октября 2018, 22:45","5","Купила в темно-синем цвете.очень уютный.Идет размер в размер.",0,"0","3"
"4255846","26 октября 2018, 11:05","1","Вообще не понравился. Цвет какой то грязно серый, выглядит как шубка, возврат.",0,"1","4"
"10162204","26 октября 2018, 10:10","5","Мне понравился, брала самый маленький, мягкий, пушистый!",1,"3","2"
"14757775","24 октября 2018, 17:09","5","Отличный свитер ,приятный к телу. Мягенький)",0,"0","1"
"3150959","24 октября 2018, 7:50","5","На мой взгляд немного большемерит. Цвет чернильно-синий. Перезакажу в другом цвете и на размер меньше.",0,"0","1"
"4319386","23 октября 2018, 20:38","5","На первый взгляд бабушкина кофта(смотрите первое фото), но если поиграть, то получается супер-вариант свитерочка оверсайз👍. Качество замечательное. Мягкая приятная к телу вещица. Очень хорошо тянется горловина, можно спустить на одно или даже на оба плеча. Мне понра! Я взяла.",4,"15","17"
"14002111","23 октября 2018, 16:40","5","Не соответствует размеру, большемерит. Очень жаль, свитер понравился. Взяла свитер этой же марки размер L",0,"1","1"
"13623909","20 октября 2018, 8:42","5","Это восторг! Заказала еще и в других цветах. Мягкий и теплый",1,"2","2"
"13023230","21 октября 2018, 9:37","3","Выглядит дешево. Синтетика. Очень увеличивает визуально",0,"4","4"
"5825930","17 октября 2018, 23:00","2","на 118-89-106 неширокие плечи и спина свитер очень большой, хорош только в плечах, ну, и в груди нормальная свобода. внизу мне прямо парашют. прямой, бесформенный. длинный, ниже середины бедра на рост 168. очень синтетический. в магазинах такого плана свитера мягче, пушистей и приятней.Заказывала еще артикул 6394671, его и взяла.",0,"0","2"
"9546547","17 октября 2018, 21:35","5","Заказывала 3 цвета, все одного размера, только белый два разных L , XL. На 48 все L как раз, но забрала xl, захотелось свободнее. Но не об этом. Одела белый xl- прям плюш, мягкий приятный , уютный. Надела голубой - более менее , но эффект мягкости уже не тот, темно синий вообще даже надевать не стала , смотрится мято, нитки торчат и на ощуп грубоват. Белый L тоже от xl отличался мягкостью))), ничего не понимаю ))). Джемпер сразу дома постирала , при 30 градусах на низких оборотах с ленором немного растянулся , но выглядит неплохо, как кот которого покупали))), надеюсь высохнет- распушится!)",2,"10","0"
"10381388","17 октября 2018, 17:22","5","Чисто белый цвет, мягкий на ощупь, приятный в носке. Хорошая длина. Скрывает огрехи фигуры. большемерит на размер.",0,"0","1"
"12149825","17 октября 2018, 15:47","4","Полнит и большемерит. На свой 52, взяла 50, но даже он оказался велик.",0,"5","1"
"10413612","17 октября 2018, 14:00","5","Кофточка понравилась! На свой m, взяла s! Подошла! Мягкая , пушистая!",0,"0","1"
"15013968","17 октября 2018, 7:34","5","Кофта хорошая но на худеньких мне показалось я на курицу в ней похожа )))",0,"1","2"
"6650627","16 октября 2018, 23:19","5","Супер мягкий и теплый пушистик! Очень нежно и женственно смотрится. Но большемерит. Прочитала отзывы и на свой M сразу заказала S - сел НЕ впритык. Берите на размер меньше.",0,"2","0"
"13083433","16 октября 2018, 15:30","5","Отличная кофта, и цвет красивый благородный. Присоединяюсь ко всем положительным отзывам. Но она не такая длинная как на фото. Попу не прикрывает.",0,"2","0"
"11833613","16 октября 2018, 14:14","5","Цвет очень насыщенный и красивый! Безумно понравился свитер. Рекомендую",1,"35","1"
"8964457","15 октября 2018, 11:51","5","Очень тёплый, жаль рукава не до запястья, по спинке длина 68 см, при моём росте 154 см можно носить и как тунику, и в юбку заправить",0,"1","1"
"5821800","15 октября 2018, 11:19","5","Джемпер интересный,уютный,теплый.Заказывала два размера,могу сказать,что большемерит. S на ОБ 100,ОТ 75,а М- огромная оказалась.",0,"0","0"
"13859091","15 октября 2018, 8:59","5","Размер соответствует, Цвет не синий, а темно-сливовый, мне даже больше понравился. Покупкой довольна.",0,"0","2"
"6066944","14 октября 2018, 19:00","5","Заказала темно-синий и синий. Больше понравился темно-синий, на свой 46 заказала М. Идёт в размер. А вот если меньше размер, то рукава будут короткие и перед джемпера тоже будет короткий. Эффектнее смотришься все же в размер. Джемпер такой мягкий! Не хотелось снимать))))) ни чего из него не лезет. Абсолютно не линяет. Рекомендую к покупке. Вайлдбериз, спасибо за скидку!!!",2,"50","1"
"5828512","14 октября 2018, 18:49","5","Полнит очень. Не взяла(",0,"0","3"
"8948243","12 октября 2018, 22:56","5","Очень мягкая, красивая и стильная! На фото мне изначально показалась как чёрная, на самом деле цвет темно синий. Очень мне понравилась !!!",1,"6","2"
"8607379","12 октября 2018, 10:27","5","Очень красивый свитер! Свободный, можно носить под ремень. На свой размер s взяла xs.",0,"0","2"
"14097804","10 октября 2018, 21:39","5","Очень понравился. Цвет шикарный. Правда запах химии остался даже после стирки с кондиционером.",0,"1","2"
"7616417","10 октября 2018, 19:52","5","Очень красивый цвет,можно сочетать с чем хочешь,качество очень хорошее,довольна!Рекомендую!!!",0,"3","3"
"9334903","10 октября 2018, 19:26","5","Свитер очень понравился. Пушистый, теплый и вообщем очень классный",0,"2","4"
"6552973","10 октября 2018, 16:15","5","До этого взяла тёмно-синий джемпер , а сегодня купила беленький. Обожаю этих пушистиков! Они идеальны!",0,"3","3"
"6089553","10 октября 2018, 15:58","5","Понравился. Мягкий и приятный. После ручной стирки слегка растянулся.",0,"5","1"
"13370735","9 октября 2018, 23:36","5","Свитер очень понравился - цвет;материал,все отлично! На рост 170 М-ка- прикрывает попу, рукава получаются 3/4 - смотрится классно!",0,"3","0"
"11396086","9 октября 2018, 22:40","5","Взяла xs на свой 42 размер ,смотрится отлично",0,"1","2"
"5915722","9 октября 2018, 20:08","4","Снимаю звезду за несоответствие фото-смотрится пушистым колобком, хотя такие кофты других производителей ношу. Фотографу, наоборот, добавляю звезду. Только жалко терять процент выкупа из-за этого",0,"1","3"
"11330008","9 октября 2018, 19:11","5","Очень красивый и женственный. Просто нежнятина, белоснежно белый, кипельно! Но большемерит, буду ждать xs!",2,"21","2"
"5954402","9 октября 2018, 15:14","5","Нежнятина!!!! Одела и не хотела снимать !! Супер джемпер! Белый к тому же очень освежает !!!",0,"4","2"
"12116992","9 октября 2018, 12:54","5","Супер даже снимать не хотелось",0,"1","4"
"12365904","9 октября 2018, 12:32","4","очень лезет, когда мерила была вся в пуху, отказ, а так приятный",0,"1","4"
"6612727","8 октября 2018, 22:08","4","на рост 175см рукав чуть-чуть ниже локтя. спереди и сзади коротковат, но не критично. могу предположить, что рост модели на фото 160см максимум. откуда на фото такая длина ярко-синего - не понятно. по качеству супер!!! достаточно плотный. 46р по объему идеально сел на 46-48, не как оверсайз. попробую больше размер, чтобы удлинить рукава.",0,"3","1"
"14720883","8 октября 2018, 20:50","5","Покупкой своей довольна.",0,"2","3"
"6567107","8 октября 2018, 20:08","5","Привет 90-е ))) помню был у меня похожий свитерок. Этот оставила, чисто внешне очень милый, сидит хорошо, чуть чуть большемерит, тк мой размер s по размерной сетке )",2,"19","3"
"8259990","8 октября 2018, 17:56","5","Заказывала аж 3раза!В ярко синем цвете смотрится не очень...взяла в темно-синем...чернильном.Уютный,об'емный,но прибавляет несколько килограммов точно",0,"0","2"
"15730529","6 октября 2018, 10:12","5","Мягкий , тёплый , 100% соответствия с описанием. На мой 48-50 подошёл L.я люблю посвободнее - мне отлично. Но предполагаю , что и m было бы тоже хорошо.",0,"3","2"
"12074439","6 октября 2018, 8:36","5","Бомбический))очень мягкий и цвет (брала синий)просто чудо",0,"4","3"
"8499372","5 октября 2018, 21:00","5","Очень приятный к телу! Понравился, действительно как шубка)",0,"1","2"
"11223507","5 октября 2018, 20:37","5","Джемпер очень понравился, пушистый и приятной для тела структуры, но очень объемный . Ради приятного качества решила пожертвовать объемами .На 52-54 размер XL сел свободно, на меньший размер не решилась, боюсь будет совсем в обтяжку . Надеюсь после стирки качество останется прежним.",0,"3","0"
"6776939","3 октября 2018, 19:37","4","красивый, качественный свитер, одна проблема-большемерит очень сильно. xs подойдет где то на 44. и на рост 167 длинноват. смотрится как шуба)",0,"0","0"
"1377202","3 октября 2018, 12:21","5","Очень женственный джемпер, но мне тоже показалось, что большемерит. Хотя как оверсайз неплохой вариант, но попробую размер поменьше перезаказать. Ткань конечно мимими)) снимать не хочется, но что будет после стирки - большой вопрос.",2,"16","2"
"12631943","28 сентября 2018, 22:49","5","Цвет настроения синий....!!!!💃🏻",1,"139","9"
"11464364","27 сентября 2018, 21:08","5","Джемпер очень понравился, пушистый и приятной для тела структуры, но большемерит: на мой 48-50 размер - подошел размер М. Размер L вернула, т.к. ""утонула"" в нем.",0,"11","3"
"9175565","26 сентября 2018, 6:31","5","Джемпер ооочень понравился. Цвет насыщенный как я и хотела. Теплый и пушистый. Обычно ношу размер М, джемпер оставила S. Спасибо магазину.",0,"11","1"
"755196","24 сентября 2018, 16:00","5","Очень красиво, уютно, комфортно. Примерила и не захотела снимать. Ногу на тонкое шёлковое платье с серебристым ремешком и сапогами, годится и к классическим чёрным брюкам. Все стремятся обнять или погладить.",0,"23","0"
"1234422","23 сентября 2018, 14:28","5","Кофта класс! Выглядит очень эффектно, цвет изумительный. На рост 175 чуть короче чем на модели, рукава заметно короче. Думаю высоким надо на размер больше брать.",0,"3","3"
"3336778","16 сентября 2018, 20:19","5","Супер-пушистик! Длина на рост 162 больше, чем на модели.",0,"8","3"